{
  "answer": "Retrieval-only mode returned candidate evidence without synthesizing a final answer.",
  "citations": [],
  "used_evidence_ids": [],
  "limitations": [
    "Retrieval-only mode: no synthesized answer is returned yet."
  ],
  "evidence": [
    {
      "evidence_id": "E1",
      "doc_id": "insp-2024-17",
      "doc_type": "inspection_report",
      "asset_type": "text_chunk",
      "chunk_id": "chunk-17-042",
      "page": 12,
      "section": "Corrosion Thresholds",
      "snippet": "The corrosion threshold for chloride exposure is triggered at 0.35% by weight under the tested conditions."
    }
  ],
  "meta": {
    "scope_mode": "scoped",
    "scoped_doc_ids": [
      "insp-2024-17"
    ],
    "docs_contributing": 1,
    "insufficient_evidence": false,
    "retrieval_summary": {
      "retrieved_candidates": 3,
      "returned_evidence": 1,
      "dropped_candidates": 2,
      "filtered_out_of_scope": 2,
      "pages_fetched": 2,
      "doc_distribution": {
        "insp-2024-17": 1,
        "insp-2024-22": 2
      },
      "candidate_content_type_counts": {
        "TEXT": 3
      },
      "source_file_modality_counts": {
        "<missing>": 3
      }
    }
  }
}
