{
  "answer": "Retrieval-only mode returned candidate evidence without synthesizing a final answer.",
  "citations": [],
  "used_evidence_ids": [],
  "limitations": [
    "Retrieval-only mode: no synthesized answer is returned yet."
  ],
  "evidence": [
    {
      "evidence_id": "E1",
      "doc_id": "insp-2024-17",
      "doc_type": "inspection_report",
      "asset_type": "text_chunk",
      "chunk_id": "chunk-17-042",
      "page": 12,
      "section": "Corrosion Thresholds",
      "snippet": "The corrosion threshold for chloride exposure is triggered at 0.35% by weight under the tested conditions."
    },
    {
      "evidence_id": "E2",
      "doc_id": "insp-2024-22",
      "doc_type": "inspection_report",
      "asset_type": "table_image",
      "asset_id": "asset-22-011",
      "asset_s3_key": "aws/bedrock/knowledge_bases/XIGQDNLDYJ/YQOEPIG0FQ/0447d19a-02d5-41ba-8359-cef7ab48defc.png",
      "page": 9,
      "caption": "Table summarizing corrosion trigger thresholds by exposure type."
    }
  ],
  "meta": {
    "scope_mode": "unscoped",
    "docs_contributing": 2,
    "insufficient_evidence": false,
    "retrieval_summary": {
      "retrieved_candidates": 2,
      "returned_evidence": 2,
      "dropped_candidates": 0,
      "filtered_out_of_scope": 0,
      "pages_fetched": 1,
      "doc_distribution": {
        "insp-2024-17": 1,
        "insp-2024-22": 1
      },
      "candidate_content_type_counts": {
        "IMAGE": 1,
        "TEXT": 1
      },
      "source_file_modality_counts": {
        "TEXT": 2
      }
    }
  }
}
